Satoshi Nakamoto, Certificado de Reconocimiento, Completar el curso de BTC, 03/01/2009, Online
Andreas Antonopoulos, Certificado de Reconocimiento a la Difución, Difundir conocimiento, 08/08/2028, Metaverso
Hanamichi Sakuragui, Certificado de Reconocimiento, Completar la Secundaria, 30/11/2000, Presencial
Rurouri Kenshin, Certificado de Reconocmiento, Completar el curso de Batusai, 01/02/2001, Kyoto
Akira, Reconocimiento de Club de Motociclistas, Máximo Pandillero, 29/02/1989, Tokyo
Shinji Ikari, The best around, Conservar nuestros AT, 09/07/2025, Tokyo 3
